1;./csv/livre1-histoire.jpg;Le procès de Nuremberg;Eric David;Un ouvrage de référence écrit par un spécialiste de la question. Très complet, le livre reprend les origines du procès, son organisation et tous ses protagonistes jusqu'au jugement et aux conséquences du procès aujourd'hui.
2;./csv/livre2-histoire.jpg;Les portes de l'enfer, la répression légale du citoyen sous Vichy;Alain-Julien Rudefoucauld;Un récit historique de la répression légale des minorités uniquement construit à partir des documents officiels publiés dans les journaux officiels de 1936 à 1946. Il ne s'agit pas d'un livre d'histoire mais bien un ouvrage portant à la lecture publique ce qu'a pu « commettre » un gouvernement légitime parce que constitutionnel, à l'époque de la Seconde Guerre mondiale. Il ne s'agit pas d'un livre sur la Shoah, mais sur toutes les exactions commises sur les minorités de 1939 à 1944, par décision officielle, par l'invention de lois fabriquant ainsi un argument de légitimité considéré comme suffisant.
3;./csv/livre3-histoire.jpg;J'étais soldat de Napoléon !: 200 ans 200 objets;Xavier Aiolfi, Vincent Bourgeot;À l'époque napoléonienne on se battait en grande tenue, le camouflage n'existait pas, l'essentiel était d'être beau devant l'ennemi, devant la mort … Cet ouvrage n'a pas pour vocation de présenter un travail didactique, encore moins technique ou purement historique, il reste avant tout un livre destiné au plaisir, et à la découverte. Il est pensé, conçu et réalisé dans le seul but de toucher tous les lecteurs, spécialistes ou non de l'histoire. Il permet de découvrir les objets accompagnant journellement la vie du soldat de Napoléon, que ce soit dans la misère ou dans le faste, dans les plaisirs ou dans leurs contextes de guerre. Autres temps, autres moeurs ! Consacré exclusivement à la période du Consulat et de l'Empire, cet ensemble (uniformes, coiffures et équipements) convie le lecteur à un voyage à travers le temps, en espérant que ces artefacts glorieux fassent prendre conscience aux français combien l'histoire de la France fut grande.
4;./csv/livre4-histoire.jpg;1453-1559: Les Renaissances;Philippe Hamon;"Ce livre efface la coupure aussi traditionnelle qu'arbitraire entre le Moyen Âge et l'époque moderne. C'est toute cette période, de Charles VII à Henri II, qui est placée sous le signe «des» Renaissances. La fin de la guerre de Cent Ans et des grandes crises socio-économiques, au milieu du XV? siècle, est effectivement le point de départ d'un renouveau général, des hommes, des échanges, des richesses... La période 1453-1559 est alors entraînée dans un mouvement de floraison, de dynamisme et de créativité en de multiples domaines; c'est ce siècle effervescent qui, en définitive, correspond bien à l'appellation de «beau XVI? siècle».Il s'agit bien ici d'un «certain regard» sur le temps des Renaissances. La dialectique du changement (emblématique des représentations sur la période) et des continuités suppose d'évaluer avec justesse l'ampleur des mutations. Elle nourrit le débat, déjà ancien, sur la «modernité» de la Renaissance:s'agit-il de l'enfantement d'un monde nouveau ou du point d'aboutissement d'un certain rapport au monde, issu des derniers siècles médiévaux? Cette interrogation permet de tisser la trame qui sépare ce temps lumineux des Renaissances des ténèbres des guerres de Religion...."
5;./csv/livre5-histoire.jpg;Une histoire mondiale du communisme (Tome 3));Thierry Wolton;"Sans le soutien des partis communistes du monde entier, la multitude des intellectuels qui ont cru en l'utopie, la complaisance des responsables politiques occidentaux à l'égard des dirigeants totalitaires, l'aide apportée aux économies socialistes par des capitalistes cupides, les régimes communistes n'auraient sans doute pas duré si longtemps. Bien des souffrances auraient pu être épargnées.
Il est désormais établi que l'espoir s'est mué en tragédie, ce qui rend ce passé si douloureux et si persistante la volonté de l'oublier. Les responsabilités sont multiples et planétaires: regarder ces vérités en face, sans honte mais sans concession, est un préalable à la compréhension de notre époque, héritière directe de ce sièce d'engagements.
Après Les Bourreux et Les Victimes, Thierry Wolton clôt avec Les Complices sa monumentale Histoire mondiale du communisme. Fidèle à sa méthode, il brosse un grand récit ponctué de témoignages, d'anecdotes, d'analyses qui complètent sa réflexion. La chronique de cette aventure humaine, qui a façonné le visage de notre nouveau siècle, donne la clef de lecture profonde de notre présent.

Edition revue et actualisée."
